{
  "version": 1,
  "kind": "doctrine-source-inventory",
  "schema_note": "Inventory-only freeze. It is not the reviewed knowledge-migration ledger governed by knowledge-migration.schema.json.",
  "authority_note": "preliminary_authority records the frozen section, explicit Authority line and accepted house-scope overrides. It is a non-final migration hint, not a reviewed disposition.",
  "baseline_commit": "7f56e4e22378323cf58318fe051d26b5afa8c35f",
  "inventory_sha256": "a7fcfb117a2e973a3cf6758c985cd35c3ba7a5730dccc8569ca7be326cfb646d",
  "standard_inventory_sha256": "a2392764ea84c3876aacd99bc05069b22af904692682dbdcac6444ccbfc5db91",
  "rows": [
    {
      "source_key": "packs/agentic-development/PACK.md:defaults:001",
      "path": "packs/agentic-development/PACK.md",
      "family": "defaults",
      "ordinal": 1,
      "start": 145,
      "end": 153,
      "block_sha256": "9e3aa2e7005c81a4eaaab25dbc33ed18f4c9a2f5cb0b76f1bb3b6e7f34bd9ec0",
      "preliminary_authority": "default",
      "legacy_anchor": "B2"
    },
    {
      "source_key": "packs/agentic-development/PACK.md:defaults:002",
      "path": "packs/agentic-development/PACK.md",
      "family": "defaults",
      "ordinal": 2,
      "start": 155,
      "end": 168,
      "block_sha256": "beea17d861a5f581df3bbc6dbcd143c1eb678409f40c6aee49462ba08151d472",
      "preliminary_authority": "default",
      "legacy_anchor": "B5"
    },
    {
      "source_key": "packs/agentic-development/PACK.md:defaults:003",
      "path": "packs/agentic-development/PACK.md",
      "family": "defaults",
      "ordinal": 3,
      "start": 170,
      "end": 178,
      "block_sha256": "486d69e8fe5319eefe8d9c68213fb35ef6b8788d432f86284c148c8acfc9da54",
      "preliminary_authority": "default",
      "legacy_anchor": "B6"
    },
    {
      "source_key": "packs/agentic-development/PACK.md:defaults:004",
      "path": "packs/agentic-development/PACK.md",
      "family": "defaults",
      "ordinal": 4,
      "start": 182,
      "end": 184,
      "block_sha256": "663faf08ee24152ae661c73500cbe122cf406083a58ab37989ad8aa1507ee1d8",
      "preliminary_authority": "default",
      "legacy_anchor": "D1"
    },
    {
      "source_key": "packs/agentic-development/PACK.md:defaults:005",
      "path": "packs/agentic-development/PACK.md",
      "family": "defaults",
      "ordinal": 5,
      "start": 186,
      "end": 192,
      "block_sha256": "ce9e0a8497d32bade7c99f08b75c56df67d8b1e8a203adeeae9a9fa226974bd2",
      "preliminary_authority": "default",
      "legacy_anchor": "D2"
    },
    {
      "source_key": "packs/agentic-development/PACK.md:defaults:006",
      "path": "packs/agentic-development/PACK.md",
      "family": "defaults",
      "ordinal": 6,
      "start": 194,
      "end": 198,
      "block_sha256": "78e4be384c55574fbfd9ee9912c783051319ce197670a308c8fc5d2693610dd3",
      "preliminary_authority": "default",
      "legacy_anchor": "D3"
    },
    {
      "source_key": "packs/agentic-development/PACK.md:defaults:007",
      "path": "packs/agentic-development/PACK.md",
      "family": "defaults",
      "ordinal": 7,
      "start": 200,
      "end": 204,
      "block_sha256": "3505c3b6825fcc6851637fb3cfcf814f1711ac83eaae4a5f4f782c6268f9b727",
      "preliminary_authority": "default",
      "legacy_anchor": "D4"
    },
    {
      "source_key": "packs/agentic-development/PACK.md:defaults:008",
      "path": "packs/agentic-development/PACK.md",
      "family": "defaults",
      "ordinal": 8,
      "start": 206,
      "end": 208,
      "block_sha256": "7d67e21fce4bcef509d1eb74bc558a570ad5c40d707b8d48ece0337b01d46b4b",
      "preliminary_authority": "default",
      "legacy_anchor": "D5"
    },
    {
      "source_key": "packs/agentic-development/PACK.md:defaults:009",
      "path": "packs/agentic-development/PACK.md",
      "family": "defaults",
      "ordinal": 9,
      "start": 210,
      "end": 213,
      "block_sha256": "c3a2da8fbed0fa741e0ec08d6e6fbccd5e5f9bbc46fb242737cabfe0416c2ff8",
      "preliminary_authority": "default",
      "legacy_anchor": "D6"
    },
    {
      "source_key": "packs/agentic-development/PACK.md:defaults:010",
      "path": "packs/agentic-development/PACK.md",
      "family": "defaults",
      "ordinal": 10,
      "start": 215,
      "end": 216,
      "block_sha256": "bb620738dc77652911f41702b9da483dc1d2401499c28df0a099abf4b5f7a880",
      "preliminary_authority": "default",
      "legacy_anchor": "D7"
    },
    {
      "source_key": "packs/agentic-development/PACK.md:defaults:011",
      "path": "packs/agentic-development/PACK.md",
      "family": "defaults",
      "ordinal": 11,
      "start": 218,
      "end": 220,
      "block_sha256": "dad5b4b67950f0c203b9b58b0e36b4ad981d57b944cec4dca1b109c1fb453d59",
      "preliminary_authority": "default",
      "legacy_anchor": "D8"
    },
    {
      "source_key": "packs/agentic-development/PACK.md:preferences:001",
      "path": "packs/agentic-development/PACK.md",
      "family": "preferences",
      "ordinal": 1,
      "start": 226,
      "end": 227,
      "block_sha256": "969780327da04c4ad09fff98f751cd5273034730cd2125064c7eae9cd53e3fe9",
      "preliminary_authority": "preference"
    },
    {
      "source_key": "packs/agentic-development/PACK.md:preferences:002",
      "path": "packs/agentic-development/PACK.md",
      "family": "preferences",
      "ordinal": 2,
      "start": 228,
      "end": 229,
      "block_sha256": "e6b554aad94062e61faab9a545842aaea595a5f9524a3ce57f650899c6f9c6ab",
      "preliminary_authority": "preference"
    },
    {
      "source_key": "packs/agentic-development/PACK.md:preferences:003",
      "path": "packs/agentic-development/PACK.md",
      "family": "preferences",
      "ordinal": 3,
      "start": 230,
      "end": 230,
      "block_sha256": "0554d7f6837d6a45597e0eb82bfb075f1534d864dac7057537063d98cf73822c",
      "preliminary_authority": "preference"
    },
    {
      "source_key": "packs/agentic-development/PACK.md:preferences:004",
      "path": "packs/agentic-development/PACK.md",
      "family": "preferences",
      "ordinal": 4,
      "start": 231,
      "end": 231,
      "block_sha256": "c13570afa35c4adbabf8b1a51c9c669645e99c66fbad7e715195d692bc4f8f2f",
      "preliminary_authority": "preference"
    },
    {
      "source_key": "packs/agentic-development/PACK.md:requirements:001",
      "path": "packs/agentic-development/PACK.md",
      "family": "requirements",
      "ordinal": 1,
      "start": 95,
      "end": 103,
      "block_sha256": "ae8597c8cb166739d9400697de8793bf43fc2e3d1e592b95032da1aad203744b",
      "preliminary_authority": "binding",
      "legacy_anchor": "B1"
    },
    {
      "source_key": "packs/agentic-development/PACK.md:requirements:002",
      "path": "packs/agentic-development/PACK.md",
      "family": "requirements",
      "ordinal": 2,
      "start": 105,
      "end": 112,
      "block_sha256": "f5e91b56d4981cfc367095ceeb9469731661e220f5a7f7cfe5083746105a5947",
      "preliminary_authority": "binding",
      "legacy_anchor": "B3"
    },
    {
      "source_key": "packs/agentic-development/PACK.md:requirements:003",
      "path": "packs/agentic-development/PACK.md",
      "family": "requirements",
      "ordinal": 3,
      "start": 114,
      "end": 125,
      "block_sha256": "0e9e89a206cca7ecc5b572042273ce64d2b9d9fe94503519aa64862008152ee8",
      "preliminary_authority": "binding",
      "legacy_anchor": "B4"
    },
    {
      "source_key": "packs/agentic-development/PACK.md:requirements:004",
      "path": "packs/agentic-development/PACK.md",
      "family": "requirements",
      "ordinal": 4,
      "start": 127,
      "end": 132,
      "block_sha256": "f2e48682f89230e09350a7c86d40205cf6646cea69a12dae98dbe4e99bbd16e7",
      "preliminary_authority": "binding",
      "legacy_anchor": "B7"
    },
    {
      "source_key": "packs/agentic-swarm/PACK.md:defaults:001",
      "path": "packs/agentic-swarm/PACK.md",
      "family": "defaults",
      "ordinal": 1,
      "start": 231,
      "end": 237,
      "block_sha256": "ebdcbcc2d655d03d4d4d7d321318727991612b2d316543be5f7f874df6f6b173",
      "preliminary_authority": "default",
      "legacy_anchor": "D1"
    },
    {
      "source_key": "packs/agentic-swarm/PACK.md:defaults:002",
      "path": "packs/agentic-swarm/PACK.md",
      "family": "defaults",
      "ordinal": 2,
      "start": 239,
      "end": 241,
      "block_sha256": "9169cb95d05dbe553a3ca465069f167bb50d049000f53e6812bb109ce322734c",
      "preliminary_authority": "default",
      "legacy_anchor": "D2"
    },
    {
      "source_key": "packs/agentic-swarm/PACK.md:defaults:003",
      "path": "packs/agentic-swarm/PACK.md",
      "family": "defaults",
      "ordinal": 3,
      "start": 243,
      "end": 247,
      "block_sha256": "91323388dd306bd0e15cb2b071a8c633ee21d8b86141b8aceba68039223fbf1a",
      "preliminary_authority": "default",
      "legacy_anchor": "D3"
    },
    {
      "source_key": "packs/agentic-swarm/PACK.md:defaults:004",
      "path": "packs/agentic-swarm/PACK.md",
      "family": "defaults",
      "ordinal": 4,
      "start": 249,
      "end": 256,
      "block_sha256": "3bfba8ba387c4e3e6422cecbd8d521a6a48fb6f68a9bfe7a84bb44e395648b65",
      "preliminary_authority": "default",
      "legacy_anchor": "D4"
    },
    {
      "source_key": "packs/agentic-swarm/PACK.md:defaults:005",
      "path": "packs/agentic-swarm/PACK.md",
      "family": "defaults",
      "ordinal": 5,
      "start": 258,
      "end": 260,
      "block_sha256": "2eb5707efdf8e2cd14485c3007e107dde734bafc311cf2cc447820430f7b4760",
      "preliminary_authority": "default",
      "legacy_anchor": "D5"
    },
    {
      "source_key": "packs/agentic-swarm/PACK.md:defaults:006",
      "path": "packs/agentic-swarm/PACK.md",
      "family": "defaults",
      "ordinal": 6,
      "start": 262,
      "end": 266,
      "block_sha256": "13719c5b047d2993fc39d91a5dbd0775e5068229cd64b44c4cb1a3e4f2799497",